Tornado ID,Time,Latitude,Longitude,Fujita scale,Damage total,Comments,,,,,,,,
1087,2010-02-16 06:00:00,-17.3600,145.5900,0,,Tornado (landspout) observed at Malanda (southeast of Atherton) at around 4pm AEST (time estimated from radar). Media articles write of a pile of tractor tyres being thrown around 100 metres in the air.,,,,,,,,
1090,2010-02-04 05:45:00,-30.5151,151.6650,0,,Funnel cloud seen from a distance of about 7km on northern edge of a small storm cell forming. Funnel cloud reported viewed from a distance to the west of Armidale on 4/2/10. No damage reported.,,,,,,,,
1091,2010-06-02 21:30:00,-28.7984,153.5845,1,,"Tornado associated with a supercell thunderstorm formed over water then moved over land at Lennox Head, causing severe damage to many homes and overturning caravans at the caravan park at about 7:30am on 3/6/10 (local time). Up to 6 people reported injured, 2 requiring hospitalisation. Widespread media coverage with video footage and damage photos on media websites. Supercell thunderstorm and associated tornado developed near Lennox Head early on the morning of 3/6/10, storm tracked north to Byron bay then turned offshore.",,,,,,,,
1094,2010-02-27 05:15:00,-36.3632,144.6995,0,,Clyve Herbert and Jane O'Neill reportedly captured 2 tornadoes on video to the SE of Rochester. NULL,,,,,,,,
1097,2010-09-13 05:48:00,-36.3560,141.3433,0,,Photos sent in by storm spotter of funnel cloud in the Miram/Diapur area. Does not appear to touch the ground in any of the photos. NULL,,,,,,,,
1098,2010-08-10 06:30:00,-36.0985,144.7513,0,,"Photo evidence of a funnel cloud extending from the cloud base.  Reports of roofs off at least one house.  Lots of low level shear was present and tornadoes were possible.  Radar cell ~16:15 local, media report suggested 5pm.  No conclusive proof, but an F0/F1 tornado looks very possible. NULL",,,,,,,,
1101,2010-05-22 12:00:00,-33.0778,115.8944,0,,"A stormspotter reportedly sighted the tornado. Direction of path was from west to east with a length of 2km. The spotter reported tree branches snapped, trees uprooted, roofing tiles lifted and damage to buildings. The passage of a deep low and associated cold front across the SWLD produced some damage around Harvey where a possible tornado occurred.",,,,,,,,
1102,2010-05-26 22:00:00,-32.2814,115.7269,0,,"An eyewitness reported seeing the tornado shortly after 10pm on the 26th from his property on Bibanup Court, Hillman. He reported a general west to east track with a speed approximately 30-40 km/h. A cold front moved through the SWLD late on the 26th with a secondary front on the 27th. SES received a total of 64 calls for assistance from across the metropolitan area over a 12 hour period.",,,,,,,,
1103,2010-07-08 22:00:00,-32.0486,115.9208,0,,A suspected weak tornado at 10pm Thursday night caused a narrow trail of damage in Perth's southern suburb of Parkwood including the felling of a large tree that fell on a house trapping a man who required hospitalisation. A front and significant cold pool caused widespread severe winds across the SWLD and Goldfields.,,,,,,,,
1104,2010-07-09 14:00:00,-32.5294,115.7233,0,,suspected tornado in the cold pool caused a trail of damage in Dudley Park adn Coodanup in Mandurah at about 2pm Friday. A front and significant cold pool caused widespread severe winds across the SWLD and Goldfields.,,,,,,,,
1110,2011-02-28 08:15:00,-31.9652,141.4513,0,,"Rope column shape, extending from cloud base to ground. Well defined, rotation evident; howling noise heard, debris churned up at the ground. Small size.%D Huge trees toppled over. Rooves torn off, fences down NULL",,,,,,,,
1111,2010-12-08 02:05:00,-31.9652,141.4513,0,,Funnel developed 1305-125 local. Remained about 60 metres above ground. Very violent thunderstorm with strong wind gusts. No hail observed at observation site. Storm lasted 45 minutes NULL,,,,,,,,
1112,2010-11-23 07:30:00,-20.7307,143.1426,0,,Possible tornado at Richmond around 5:00pm AEST. No damage reported. ABC radio media report of a tornado touchdown at Richmond. Satellite confirms anomalous moving TS over area between 5:30pm and 6:30pm.,,,,,,,,
1113,2010-12-01 02:38:00,-31.4985,145.8346,0,,"Bureau's Cobar observer thought he saw a 1/2 funnel cloud"" out of the bottom of a CB - it didn't reach the ground and he wasn't positive it even was one"," but could have been - very brief - but thought he saw rotation. NULL""",,,,,,,
1114,2010-12-25 01:00:00,-21.3000,149.2000,1,,"Tornado observed near Alligator Creek (south of Mackay) around 11am AEST. Media images showed bits of roofing removed from at least two houses and numerous branches broken off trees. Reported tornado at Alligator Creek between 10am and 11am. Media reports of damage support this, with photos.",,,,,,,,
1115,2011-01-19 07:20:00,-29.6484,152.8011,0,,Small tornado(s) momentarily touching down.  Roaring sound and debris being flung against the side of the house. NULL,,,,,,,,
1116,2010-08-10 00:00:00,-36.1298,144.7508,0,,Photographs show tornado touching ground with air-born debris. Tornado observed near Echuca/Moama with photographic evidence in media.,,,,,,,,
1117,2011-02-03 07:20:00,-36.9015,143.9795,0,,Over 50 very large trees down on Bridgewater-Maldon Rd between Kellys Rd and Shelbourne Rd. Roads blocked to traffic. Power outage until 1415UTC 03/02/2011. NULL,,,,,,,,
1118,2011-02-04 05:00:00,-37.8436,144.9740,0,,Funnel cloud reported over Melbourne area. Preliminary radar data suggests left moving supercell over bay. Funnel Cloud.,,,,,,,,
1119,2010-10-06 04:30:00,-36.7924,143.5519,0,,Tornado touchdown north of Bealiba. Tornado,,,,,,,,
1120,2010-11-07 05:05:00,-37.4248,144.5612,0,,Cell appears to have dropped a tornado SW of Macedon. NULL,,,,,,,,
1121,2011-02-04 06:22:00,-36.3613,144.6985,0,,"Funnel not reaching the ground, although spotter noted that it may have reached the ground at one point. Photographic evidence provided via email. NULL",,,,,,,,
1122,2011-02-28 08:36:00,-31.9652,141.4513,0,,"6am Synop for Broken Hill on the 1st March reports tornado the previous evening Feb 28th at 19:06pm local.  Broken Hill is UTC  9:30.  So UTC time of event was 08:36Z. ""Considerable damage"" reported. NULL",,,,,,,,
1123,2011-05-23 09:30:00,-25.5200,152.6800,0,,Possible tornado in Maryborough around 7:30pm AEST. Media images indicated that sheds had been blown over and some large trees with shallow roots had fallen. NULL,,,,,,,,
1127,2010-10-02 06:00:00,-35.3317,148.8012,0,,Weatherzone forum posts pictures of a funnel cloud over the Brindebella ranges about 4pm. NULL,,,,,,,,
1130,2010-09-04 07:00:00,-37.2160,145.1053,0,,Spotter observed funnel cloud. Sent in photo of trees uprooted. Investigation of radar indicates tornado was likely due to low-level vorticity as no meso-cyclone evident on radar. NULL,,,,,,,,
1135,2011-02-11 08:30:00,-12.9000,132.5167,0,,"Tornado reported in NT News. Excellent video footage filmed at about 6:00 pm (CST) by David Chemello, Gagudju Dreaming Tour Guide with one video of 23 seconds and part 2 of the video lasting 50 seconds. Unfortunately, no doppler data available to verify if radar (velocity) signature was consistent as Cooinda is within Tindal radar range. NULL",,,,,,,,
1165,2011-01-12 01:20:00,-12.9000,131.1900,0,,"Tornado was not observed by anyone. It was inferred using Berrimah Doppler radar in association with observed damage reports from the area by local residents and BoM meteorologists. Observed damage included significant amount of felled banana trees (80% crop damage) with healthy trunks snapped, some 40cm in diameter, while others uprooted. Reports of sounds of a jet engine"" from local residents. Similar damage reports at two other locations upstream from Lake Bennett near Manton Dam and Darwin River Dam. Total path length approximately 50km. NULL""",,,,,,,,
1188,2011-10-29 23:13:00,-30.6317,150.6678,0,,Tornado touched the ground briefly. Maximum wind gust of at least 100 km/hr. NULL,,,,,,,,
1189,2011-11-08 01:20:00,-36.9151,149.2346,0,,Report of roof damage (roof blown off house) at Bombala by SES. Confirmation of tornado at Bombala from Weatherzone forum and online news pictures.  NULL,,,,,,,,
1190,2011-10-01 13:45:00,-37.0561,146.0867,0,,NULL Tornado near Mansfield,,,,,,,,
1191,2011-10-28 07:00:00,-37.6604,145.3731,0,,Funnel cloud / possible tornado near Yarra Glen. Flanking Line and Wall Cloud reported. Multiple phenomena associated with discrete cells organised along a trough of low pressure.,,,,,,,,
1192,2011-12-25 06:05:00,-37.6572,144.2306,0,,Rotating wall cloud first observed ~0530UTC near Fiskville. Tornado reported near Twin Lakes Road. Doppler RADAR analysis indicated Strong Mesocyclone (21.5). Large hail also reported. NULL,,,,,,,,
1193,2011-12-25 06:50:00,-37.6471,145.0288,0,,Reported near Epping Shopping Centre. Rotating wall cloud first observed ~0530UTC near Fiskville. Tornado reported near Twin Lakes Road Fiskville 0605. Doppler RADAR analysis indicated Strong Mesocyclone (21.5). Dust/debris also reported. NULL,,,,,,,,
1194,2012-01-11 00:12:00,-37.8446,145.2668,0,,"Reports from media/weather forums of a mini-tornado"" in the Bayswater area. No evidence on RADAR. Most likely period during 2130-0030UTC with cells at:%D 2154",2254-2309,2342,0006-0018 (Mostly likely cell). Cold air outbreak with strong prevailing S/SW wind. Just under 700 RFAs, mostly for trees down, blocked roads, power lines down," roof damage. Media/weather forums report ""mini-tornado"" near Bayswater - entered as most likely cell.""",
1195,2011-12-25 06:40:00,-37.6664,144.8458,0,,Possible tornado '1km away' from Melbourne Airport. Date unknown but event and time entered as most likely according to RADAR data. NULL,,,,,,,,
1196,2012-02-27 04:40:00,-34.1942,142.1559,0,,Report of possible tornado in Mildura township to SES. Roof reportedly lifted from house. NULL,,,,,,,,
1197,2012-02-27 04:40:00,-34.2316,142.0815,0,,"Photo of alleged tornado available in storm spotter log book. Damage reported at Mildura Airport: massive roller door blown clean off the wall amongst other things"" of a hanger/shed. ""Pets in crates were strewn all over the Air Express facility"," and the place was a mess."" NULL""",,,,,,,
1198,2012-04-06 07:35:00,-38.0755,144.3574,0,,"Article in Geelong Advertiser 7 April 2012 (attached to Storm Spotter Logbook). %D ""Mr Moroney watched in disbelief as a mini-tornado lifted and dumped 20m of fence on his Corio home... ripped from the ground and tossed onto his shed roof and a nearby car."" NULL",,,,,,,,
1199,2012-04-22 06:34:00,-36.4703,145.6305,0,,"Photos available via email chain with Ted Williams, Dean Sgarbossa, Tony Bannister, Steven McGibbony. RADAR data showed weak low-level mesocyclone with possible RFD/FFDs. NULL",,,,,,,,
1200,2012-04-08 09:45:00,-33.6901,151.1096,0,,"Massive pine tree uprooted, evidence in post analysis points to rotation in the cell. Post analysis of doppler showed evidence of rotation/tornado",,,,,,,,
1201,2012-03-16 05:55:00,-30.5026,151.6372,0,,"Thin ropy cloud 1000-1200m below cloud base, curved to NW. NULL",,,,,,,,
1202,2012-05-24 05:30:00,-37.1503,142.7567,0,,Tornado was reported to last for about one minute and to move from the northeast before turning around and coming from the south. Considerable damage was reported including a wooden verandah lifted in its entirety and moved approximately 200m from its original location. Eye-witness reports and photos available on shared drive at S:\Victoria\Shared\SevereWx\Events Tornado reported south of Stawell. Eye-witness reports and photographs received.,,,,,,,,
1203,2012-06-16 07:00:00,-37.7043,142.1095,0,,Photos show funnel cloud reaching ground and tree shredded of all upper branches. NULL,,,,,,,,
1204,2012-04-23 03:30:00,-41.1660,146.5530,0,,"The tornados were observed from Port Sorell, appearing to be located over the water near Hawley beach. Two funnels were observed. Good photos were provided of the funnel clouds. No known damage as the tornados didn't appear to make landfall. The first funnel lasted about 10 minutes and the second one 5 to 10 minutes. NULL",,,,,,,,
1205,2011-10-28 00:00:00,-34.3039,140.5192,0,,NULL A trough moving across the state triggered showers and thunderstorms about the Riverland during the afternoon and evening. A tornado was reported at Winkie in the Riverland causing damage to property and vegetation.,,,,,,,,
1206,2011-11-08 00:00:00,-34.1726,140.7431,0,,"There were also damage reports from the Riverland, including a report of a “mini tornado”. Thunderstorms developed in the NWP during the afternoon, producing damaging wind gusts and local flash flooding. The system tracked east-southeastwards across the Flinders, Mid North, Riverland and Murraylands districts in the evening with most thunderstorms clearing the eastern border in the early hours of the morning.",,,,,,,,
1209,2012-06-29 08:00:00,-34.7883,138.4957,0,,"Damage may have been result of tornado. No actual severe winds recorded. A number of lines of squally showers moved across the Adelaide metropolitan in the morning. Damage was reported at Windsor Gardens and North Haven, both may have been result of tornado.",,,,,,,,
1210,2012-06-29 07:00:00,-34.8684,138.6498,0,,"Damage may have been result of tornado. No actual severe winds recorded. A number of lines of squally showers moved across the Adelaide metropolitan in the morning. Damage was reported at Windsor Gardens and North Haven, both may have been result of tornado.",,,,,,,,
1211,2010-07-14 10:00:00,-34.4380,138.5096,0,,"Redbanks, near Mallala : Another cell spawned a tornado at about 10:00 am, which cut swathe of damage through a farm property. Besser block stable destroyed, roof blown off, fences destroyed, trees ripped out and fences blown over. A report of a big tree lying across railway track 6 km away. Damage estimated as F0 to low end F1? One witness captured the tornado on camera. Cold front with several associated bands of convection tracked across Adelaide and southern SA during the morning. Two severe cells.",,,,,,,,
1212,2010-07-31 17:30:00,-37.3771,140.8376,1,,"One long-lived thunderstorm, which formed just ahead of the cold front, tracked across LSE, from near Robe, through Penola and into western Vic, during the late afternoon/early evening. The storm spawned a tornado, which ripped a narrow path of damage through the town of Penola. About forty buildings were damaged, several homes suffered severe damage, rendering them uninhabitable. The bowling clubhouse was destroyed, hardware store unroofed and several businesses suffered smashed windows and collapsed walls. Damage path was 6 km long, but only 40-50 metres wide, consistent with high end F1, possibly low end F2 intensity. Early estimates put the damage bill at several millions of dollars. Fortunately, there were no serious injuries.%D %D A second tornado spawned from another cell damaged farm buildings and trees on a property at Claywells. Several long lived thunderstorms tracked through the South East of SA ahead of a strong cold front which tracked across southern SA (including Adelaide) Also deep convection aligned along the front.",,,,,,,,
1213,2010-07-31 17:30:00,-37.3427,140.1199,0,,tornado also at Penola. A second tornado spawned from another cell damaged farm buildings and trees on a property at Claywells. Several long lived thunderstorms tracked through the South East of SA ahead of a strong cold front which tracked across southern SA (including Adelaide) Also deep convection aligned along the front.,,,,,,,,
1214,2010-10-14 00:00:00,-33.2288,138.8863,0,,"thunderstorm near Whyte-Yarcowie spawned a funnel cloud, which was observed and photographed. thunderstorms",,,,,,,,
1215,2010-10-14 00:00:00,-34.2831,140.6026,0,,funnel cloud or tornado was spotted to the southwest of Berri. thunderstorms,,,,,,,,
1216,2010-12-07 00:00:00,-34.7804,138.6705,0,,"NULL widespread thunderstorm activity. Severe convection first broke out over the Eyre Peninsula during mid morning and around midday severe thunderstorms could be identified around the MLR. Lines of thunderstorms that formed over the EP gradually moved eastwards across southern parts of the state effecting the YP, MN, F, ML, LSE and RIV districts. %D %D Impressive radar echoes were identified particularly in the MN and ML districts in the form of bow echoes and rotating cells. Reports of severity included very heavy rainfall and flash flooding at locations in the Adelaide region and Mount Lofty Ranges, MN and EP.",,,,,,,,
1217,2012-06-07 04:00:00,-31.9000,115.9000,1,,"Wind speeds estimated from a damage survey carried out by Geoff Boughton. Path width estimated from damage survey path on map. The passage of a trough associated with a low to the southwest of the state produced two confirmed tornadoes. One near the Perth suburbs of Dianella and Morley and one near York, both around midday WST",,,,,,,,
1218,2012-06-07 04:00:00,-31.9000,116.8000,0,,"No official report of this event The passage of a trough associated with a low to the southwest of the state produced two confirmed tornadoes. One near the Perth suburbs of Dianella and Morley and one near York, both around midday WST",,,,,,,,
1219,2011-02-15 17:00:00,-34.9516,138.8756,0,,"A resident 4 km from Woodside reported a tornado at his property, the tornado damaged three sheds and caused tree damage at around 5 pm. thunderstorms",,,,,,,,
1223,2013-01-15 03:50:00,-24.8400,143.0600,1,,Media articles wrote of the Barcoo Shire Council CEO reporting that two council staff saw two tornadoes. Media images showed a roof off a house and a number of overturned cars and trucks. NULL,,,,,,,,
1224,2013-01-21 08:00:00,-33.6317,146.9679,0,,A second hand report from Sean Carson. NULL,,,,,,,,
1225,2013-03-21 08:40:00,-35.9152,145.7013,0,,Report made to the Bureau by SES. Subsequent examination of radar data gives sufficient confidence to label event a tornado. NULL,,,,,,,,
1226,2013-02-23 16:00:00,-34.6567,150.7012,0,,LGA: Greater Wollongong%D %D Lat Longs that define the path:%D Minnamurra    -34.620        150.852%D               -34.629        150.825%D Jamberoo      -34.644        150.768 NULL,,,,,,,,
1227,2013-02-23 16:15:00,-34.6651,150.8679,1,,LGA: Greater Wollongong%D %D Tornado 2 - Kiama (Rated as EF1 on the enhanced Fujita scale).%D                     -34.663        150.853%D                     -34.666        150.848%D                     -34.670        150.839 NULL,,,,,,,,
1228,2013-02-23 16:25:00,-34.8151,150.7679,2,,Tornado 3 - Seven Mile Beach to Nowra Council Chambers (Rated as EF2 on the enhanced Fujita scale).%D                     -34.819         150.762%D                     -34.837         150.716%D                     -34.853         150.674%D                     -34.868         150.603 NULL,,,,,,,,
1235,2013-03-21 08:30:00,-35.9670,146.0320,3,,NULL NULL,,,,,,,,
1236,2013-03-21 19:40:00,-36.0577,146.4615,0,,Extensive damage  NULL,,,,,,,,
1237,2013-03-21 00:00:00,-36.7489,145.9997,1,,Damage to vegetation cosistent with tornado: ~100m wide path of trees damaged/defoliated. (Fully established Red Gums destroyed). Trees >100m not damaged. NULL,,,,,,,,
1238,2013-03-21 00:00:00,-37.0561,146.0867,1,,2 tornados (possibly) causing damage with bowing line segement and roof damage NULL,,,,,,,,
1239,2013-03-21 00:00:00,-36.5524,145.9988,0,,photograph taken of tornado NULL,,,,,,,,
1240,2013-03-21 04:00:00,-35.7323,143.9189,0,,Photo of tornado. No reported Damage. NULL,,,,,,,,
1241,2010-11-29 00:00:00,-22.6600,114.1800,0,,"A small tornado was reported. A storm was reported from Bullara Station in the Gascoyne which produced 43mm of rain, marble sized hail, strong winds and a small tornado. The convection was associated with a surface trough and an upper trough to the west.",,,,,,,,
1242,2011-01-05 00:00:00,-33.8333,116.3906,0,,"A possible tornado was reported at Boyup Brook where some trees were felled, water was drained from a dam and 35mm of rain was recorded during the event. Thunderstorms produced severe wind gusts and heavy rain in the Central Wheatbelt and Southeast Coastal districts.",,,,,,,,
1243,2011-05-20 00:00:00,-32.0803,115.9153,0,,"The tornado was associated with a cold front crossing the west coast. A mini-tornado"" was reported in Canning Vale around 8am", propelling a pergola through a neighbours car, removing roof tiling," and wrapping metal from a patio around overhead power lines.""",,,,,
1244,2011-05-29 13:00:00,-33.3403,115.6419,0,,"NULL The passage of a cold front across the SW corner was accompanied by a tornado in Bunbury at around 9pm. A tree fell on a house, several houses sustained roof/patio damage, small trees were twisted off at ground level and one house had its roof torn off entirely. The damage was confined to two streets in the Bunbury suburb of Usher. Heavy rain fell across the Southwest Land Division and FESA received several calls for help from Perth residents for water damage.",,,,,,,,
1245,2011-06-30 03:10:00,-32.5294,115.7233,0,,NULL A pre-frontal trough and cold front moved through the SWLD during the day with reports of a tornado near Mandurah at about 11:10am.,,,,,,,,
1246,2011-07-22 07:26:00,-32.3744,115.9964,0,,NULL The passage of a cold front produced a tornado near Serpentine and flash flooding in Fremantle. The tornado occurred near Serpentine about 3:26pm.,,,,,,,,
1247,2011-07-27 14:30:00,-32.8289,115.8808,0,,"NULL A strong cold front moved through southwest parts of WA late afternoon on the 27th bringing heavy showers, thunderstorms and severe wind gusts. Damage consistent with the passage of a tornado occurred at Waroona about 10:30pm on the 27th.",,,,,,,,
1248,2013-02-15 16:20:00,-32.4049,134.5335,0,,"A storm spotter reported damage from a suspected tornado at a property near Pimbena in the West Coast. Damage the roof and wall of a 2 sheds (debris found 150-200 m away) and damage to trees were reported. Estimated time of damage was 1620 CDT. Thunderstorms developed in a very moist and unstable airmass. Thunderstorm activity was focused in areas with triggers, notably a trough in the West and a sea breeze trough in the southeast. Thunderstorms developed about the Mount Lofty Ranges and northern suburbs Adelaide.",,,,,,,,
1249,2013-07-04 18:00:00,-34.6431,135.6974,0,,"NULL A line of showers and thunderstorms aligned along a trough tracked across Lower Eyre Peninsula and Kangaroo Island during the early morning on 4 July. One of these showers spawned a tornado, which cut a narrow swathe of damage through a farm property at Big Swamp, northwest of Port Lincoln just after 6 am. About 50 trees were blown over or lost limbs, a trampoline was blown into the farm house and an iron gate torn off its hinges. %D %D During the afternoon and evening of the same day, 4 July, squally westerly winds associated with convective showers affected southern coastal districts with and following a vigorous cold front. Severe wind gusts of 90-95 km/h were recorded at Cape Borda and Parndana on Kangaroo Island and at Cape Jaffa in the Lower South East district.%D",,,,,,,,
1250,2013-08-03 12:40:00,-36.8322,139.8538,0,,"NULL A band of showers and thunderstorms associated with a front tracked across the Upper and Lower South East districts on 3 August. One of these showers spawned a tornado, which cut a narrow, 1.5 km long swathe of damage through the town of Kingston at 12:40 pm. About 25 buildings were damaged, with 14 suffering significant damage. Several people witnessed the tornado but fortunately no-one was injured. %D %D Shortly later a second tornado associated with a separate shower badly damaged a large farm shed and trees on a property at Keilira, about 30 km northeast of Kingston.",,,,,,,,
1251,2013-08-21 18:00:00,-34.7251,138.5821,0,,"NULL A heavy convective shower spawned a short-lived tornado, which damaged three properties near Waterloo Corner on the northern outskirts of Adelaide just before 6 pm on 21 August. A glasshouse was smashed, a 10-tonne truck tipped over and a large iron clad shed extensively damaged. Flying glass debris from the glasshouse damaged solar panels and trucks parked nearby. The damage path was about 500 metres long and 20 metres wide.",,,,,,,,
1252,2013-11-18 03:45:00,-33.7026,151.1123,1,,"LGA: Sydney, Hornsby Shire NULL",,,,,,,,
1253,2013-11-23 04:30:00,-30.1317,151.4345,1,,Additional anecdotal reports suggest a path length of up to 4-6km. NULL,,,,,,,,
1254,2013-11-23 05:00:00,-30.1817,151.8011,0,,Tornado just north of Wards Mistake Rd. NULL,,,,,,,,
1255,2013-11-23 04:30:00,-30.0984,151.2511,0,,"Width estimated at less than 100m.%D Path at least 1000 long, though this  was not fully assessed due to access and time retraints. NULL",,,,,,,,
1256,2013-11-23 04:30:00,-30.0151,151.6511,1,,Path was not completely mapped due to access and time restrictions. NULL,,,,,,,,
1257,2013-12-26 05:00:00,-36.0984,149.1679,0,,NULL NULL,,,,,,,,
1258,2012-01-05 00:00:00,-33.1367,116.8414,0,,NULL Rainfall observer at Moree (44km SSW of Southern Cross) reported that on 5 January a tornado hit our house, lost our roof, trees down everywhere,"wind came from NW"" They recorded 12.6 mm of rainfall in the 24 hours to 9am 6 January.""",,,,,
1259,2013-07-07 08:00:00,-36.8100,144.6600,0,,"Report from CFA of heavy tree damage in a narrow path approximately 400m long. Damage was reportedly in all directions. Review of radar data shows long-lasting, left-moving cell in the vicinity of the reported damage. NULL",,,,,,,,
1260,2013-07-15 07:15:00,-32.3567,149.6679,0,,Photo sent in from storm spotter of funnel cloud not reaching ground. NULL,,,,,,,,
1261,2013-07-15 07:15:00,-32.3567,149.6679,0,,Photo sent in from storm spotter of funnel cloud not reaching ground. NULL,,,,,,,,
1262,2013-11-23 02:00:00,-38.0833,144.2666,0,,Photo of funnel cloud not reaching the ground. NULL,,,,,,,,
