Tornado ID,Time,Latitude,Longitude,Fujita scale,Damage total,Comments,,,,,,,,
1334,2013-01-23 13:30:00,-19.6900,147.4700,0,,"The report of a tornado at Inkerman (southeast of Ayr) was submitted by a local cane farmer to the Bureau of Meteorology office in Townsville on the 25 January 2013. The exact time of the tornado was unknown, but it is suspected to have occurred on the night of 23 January 2013 or the morning of 24 January 2013. The farmer reported a 200m swath of destruction through his cane field and that the damage appeared to have occurred in a circular fashion. The environment was conducive for tornadoes at the time of the event and radar indicated that there may have been cells with a potential mesocyclone in the area during the assumed time of the tornado event. No Rapid Damage Assessment was conducted in the area by Queensland Fire and Emergency Services to confirm the passage of a tornado, no Doppler radar data was available and no images of the reported damage were provided, so it was difficult to confirm whether the damage could be attributed to a tornado. NULL",,,,,,,,
1335,2013-01-23 18:15:00,-21.2900,149.3000,0,,"The Hay Point Automatic Weather Station (033317) recorded a 3-second wind gust of 139km/h at 4:15am AEST on 24 January 2013. The environment was conducive for tornadoes and radar indicated that there was a cell with a potential mesocyclone in the area at the time of the event. No damage was reported from the area and no Doppler radar data was available, so it was difficult to confirm whether the recorded wind gust could be attributed to the occurrence of a tornado. NULL",,,,,,,,
1336,2013-01-26 05:00:00,-24.7800,152.4200,2,,"It was concluded that damage in parts of Burnett Heads (associated with the eastern tornado) matched the specifications of an F2 tornado. The evidence used to come to this conclusion included the image of a roof torn off a frame house on the Sea Esplanade. Rapid Damage Assessment data supplied by Queensland Fire and Emergency Services noted that two properties had lost roofs during the event (including the property on the Sea Esplanade). The second confirmed tornado during the TC Oswald tornado event. Doppler radar indicated the presence of a ""strong"" mesocyclone off the Burnett Heads coast prior to impact. Rapid Damage Assessment data supplied by Queensland Fire and Emergency Services showed a clear path of damage through Burnett Heads. NULL",,,,,,,,
1337,2013-01-26 06:00:00,-24.7700,152.4200,2,,"It was concluded that damage in parts of Burnett Heads (associated with the western tornado) matched the specifications of an F2 tornado. The evidence used to come to this conclusion was comments made in Rapid Damage Assessment data supplied by Queensland Fire and Emergenct Services about a wall being blown out of a house on Burnett Heads Road. Arguably, the level of damage reported meets part of the specification of an F3 tornado, though there was a lack of supporting evidence and information about the structure impacted to make this call. The second confirmed tornado that occurred at Burnett Heads during the TC Oswald tornado event. Doppler radar indicated the presence of a strong"" mesocyclone over Burnett Heads at the time of impact. Rapid Damage Assessment data supplied by Queensland Fire and Emegerency Services showed a clear path of damage through Burnett Heads. NULL""",,,,,,,,
1338,2013-01-26 05:00:00,-24.9800,152.4500,0,,"A report of a tornado at Coonarr (southeast of Bundaberg) was submitted by Queensland Fire and Emergency Services on the afternoon of 26 January 2013. Doppler radar indicated the presence of a mesocyclone in the area at the time. However, no Rapid Damage Assessment was conducted in the area by Queensland Fire and Emergency Services to confirm the passage of a tornado and no damage was reported by the general public and/or media after the event. NULL",,,,,,,,
1339,2013-01-26 06:10:00,-25.0000,152.0800,0,,"A tornado was reported at Bungadoo (south-southwest of Bundaberg) on the afternoon of 26 January 2013 by Queensland Fire and Emergency Services. Doppler radar indicated the presence of a mesocyclone in the area at the time. QFES reported that large trees were uprooted in the area. However, no Rapid Damage Assessment was conducted in the area by Queensland Fire and Emergency Services to confirm the passage of a tornado. NULL",,,,,,,,
1340,2013-01-26 13:50:00,-25.2300,152.5900,1,,"It was concluded that damage in parts of Burrum Heads (associated with the tornado that caused damage over inland parts of the town near the Burrum River) matched the specifications of an F1 tornado. The evidence used to come to this conclusion was comments made in Rapid Damage Assessment data supplied by Queensland Fire and Emergency Services about roofs being damaged on some houses in the area. The fourth confirmed tornado during the TC Oswald tornado event. The tornado caused damage over inland parts of the town near the Burrum River. Doppler radar indicated the presence of a ""strong"" mesocyclone over Burrum Heads at the time of impact. Rapid Damage Assessment data supplied by Queensland Fire and Emergency Services after the event showed a clear path of damage through Burnett Heads. NULL",,,,,,,,
1341,2013-01-26 17:40:00,-25.1800,152.6100,3,,"It was concluded that damage in parts of Burrum Heads (associated with the tornado that caused damage to coastal areas of the town) largely matched the specifications of an F2 tornado, though there was also evidence of damage matching that of an F3 tornado. The evidence used to come to this conclusion included images of a roof and some walls torn off a frame house in Sunrise Crescent and that a cabin in the local caravan park appeared to have been lifted and thrown some distance. The second confirmed tornado that occurred at Burrum Heads during the TC OSwald tornado event. The tornado caused considerable to severe damage about coastal areas of Burrum Heads. Doppler radar indicated the presence of a strong"" mesocyclone just offshore of Burrum Heads prior to impact. Rapid Damage Assessment data supplied by Queensland Fire and Emergency Services showed a clear path of damage through Burrum Heads and included notes about 14 properties with at least ""Severe"" damage. NULL""",,,,,,,,
1342,2013-01-26 18:30:00,-25.2700,152.7600,1,,"It was concluded that damage in parts of Dundowran Beach matched the specifications of an F1 tornado. The evidence used to come to this conclusion included an image of some snapped and/or uprooted trees at a property at Dundowran Beach. Given the strength of the mesocyclone and the size of the trees uprooted in the image it is possible that there may have been some F2 or greater damage in the area. However, as there was no Rapid Damage Assessment conducted by Queensland Fire and Emergency Services and no detailed media report attached to the image it was decided that there was insufficient evidence to commit to a stronger damage specification. The sixth confirmed tornado during the TC Oswald tornado event. Doppler radar indicated the presence of a strong"" mesocyclone over the area at the time and in fact it appeared to be one of the stronger mesocyclones evident on radar during the entire event. No Rapid Damage Assessment was conducted by Queensland Fire and Emergency Services in the area after the event"," so it was not possible to ascertain the length and width of the tornado track. NULL""",,,,,,,
1343,2013-06-12 09:30:00,-28.0900,151.7800,2,,"Possible tornado in Pratten around 7:30pm AEST and Bony Mountain shortly after. Emergency Management Queensland advised of major damage to a property with large trees blown down at Pratten. State Emergency Services images show widespread defoliation of trees with some trees snapped, one house with part of its roof missing and a caravan tipped on its side. Media images showed a large storage shed blown over at Bony Mountain and a decimated, near-completed"" home at Pratten. Media articles wrote of 6 houses with lost roofs"," one destroyed and decimated farm infrastructure. NULL""",,,,,,,
1344,2013-11-18 17:00:00,-25.2800,152.9000,1,,Tornado (most likely a waterspout coming ashore) in Urangan (Hervey Bay) around 3am AEST. Media articles write of trees bring knocked down (no images available to ascertain the size of the trees or the depth of their roots) and images show the roof (or part of) removed off two houses. NULL,,,,,,,,
1345,2015-10-14 06:00:00,-27.4700,151.9400,0,,Tornado (landspout) observed at Highfields (north of Toowoomba) around 4pm AEST. No damage reported. NULL,,,,,,,,
1346,2015-02-20 22:30:00,-26.6800,153.1100,0,,"Possible tornado in Mooloolaba around 8:30am AEST. Media images showed that branches had been broken off some trees, some shallow rooted trees had been uprooted and a small catamaran had been flipped into a pool. NULL",,,,,,,,
1347,2016-08-24 07:30:00,-26.6500,153.0000,0,,"Tornado (landspout) observed east of Drillham (west of Miles) around 5:30pm AEST. No damage was reported, though some debris was sent flying. NULL",,,,,,,,
1348,2016-11-12 07:30:00,-25.5600,152.3200,0,,Possible tornado at North Aramara (southwest of Maryborough) around 2:40pm AEST. No reported damage. NULL,,,,,,,,
1349,2017-01-15 01:45:00,-26.8000,153.0500,0,,Tornado (landspout) observed near Bells Creek around 11:45am AEST. No damage reported. NULL,,,,,,,,
1350,2017-03-17 04:00:00,-27.4000,153.1000,0,,Tornado (landspout) observed near Brisbane Airport around 2pm AEST. Media images showed that some shallow rooted trees were uprooted. NULL,,,,,,,,
1351,2017-03-30 00:30:00,-24.3300,151.5600,2,,Possible tornado at Miriam Vale around 10:30am AEST. Media images show the roof removed off a house and articles note that the roofs of two other houses were removed. NULL,,,,,,,,
1352,2017-10-14 00:00:00,-27.9000,153.0000,0,,Tornado observed near Cedar Vale around 10am AEST (appears to be a landspout). No damage reported. NULL,,,,,,,,
1353,2017-12-31 01:00:00,-28.0500,152.0000,0,,Tornado observed near Allora around 1pm AEST. No damage reported. NULL,,,,,,,,
1354,2014-12-06 02:00:00,-25.2900,152.8600,0,,"Tornado (most likely a waterspout coming ashore) observed in Torquay (Hervey Bay) around 12pm AEST. Witness alledges seeing three waterspouts, one coming ashore. Media images showed part of a fence down and articles write of a shed being blown over. NULL",,,,,,,,
1355,2012-02-14 21:30:00,-21.1400,149.2000,0,,"Tornado (landspout) observed in Mackay (on the Pioneer River, near the River Street boat ramp) around 7:30am AEST. No damage reported. NULL",,,,,,,,
1356,2011-12-14 09:00:00,-16.4500,145.3700,0,,Tornado (landspout) observed near Mossman around 7:00pm AEST. No damage reported. NULL,,,,,,,,