Tornado ID,Time,Latitude,Longitude,Fujita scale,Damage total,Comments,,,,,,,,
1263,2013-10-24 01:00:00,-37.9215,145.1660,0,,Photo of funnel cloud not reaching the ground. NULL,,,,,,,,
1264,2013-12-05 03:25:00,-38.0503,145.1651,0,,Photo of funnel cloud not reaching the ground. NULL,,,,,,,,
1265,2012-06-07 04:00:00,-31.8878,115.8742,0,,significant damage to about 20 homes and felled trees and power lines. Most were minor roof damage but about 10 buildings were more severely damaged. Passage of a trough with with reported tornadoes,,,,,,,,
1266,2012-11-03 08:05:00,-33.6614,115.3511,0,,"reported from the tuart forest in the area near the intersection of Layman Rd and Tuart Dr, Wonnerup Tornado reported from Busselton Shire",,,,,,,,
1267,2013-01-15 00:00:00,-33.5558,115.5608,0,,Just after 6am a thunderstorm crossed the coast to the southwest of Capel in the vicinity of the Ludlow State Forest.%D Tuart Drive was blocked by large trees and debris was across Bussell Highway but it didn't appear to have hit any buildings. Possible tornado in the Southwest district,,,,,,,,
1268,2013-09-23 00:00:00,-31.9819,115.8633,0,,"A tornado was also reported in the southeast suburbs of Perth, where significant structural damage occurred.%D %D The second, and strongest, clod front moved over the southwest region in the early hours of Sunday the 23rd. This front was associated with a low that was analysed as low as 959hPa. The peak Geraldton to Albany pressure difference was observed at 21.7hPa which was the strongest since the event of 28 Novemeber 2012, and strongest winter event since a delta of 21.9hPa was observed on 10 June 2012. Widespread damaging winds were experienced over the SWLD with severe gusts recoreded at many locations. Strong cold fronts and deep low affect SWLD",,,,,,,,
1269,2013-09-23 00:00:00,-31.9819,115.8633,0,,"A tornado was also reported in the southeast suburbs of Perth, where significant structural damage occurred.%D %D The second, and strongest, clod front moved over the southwest region in the early hours of Sunday the 23rd. This front was associated with a low that was analysed as low as 959hPa. The peak Geraldton to Albany pressure difference was observed at 21.7hPa which was the strongest since the event of 28 Novemeber 2012, and strongest winter event since a delta of 21.9hPa was observed on 10 June 2012. Widespread damaging winds were experienced over the SWLD with severe gusts recoreded at many locations. Strong cold fronts and deep low affect SWLD",,,,,,,,
1270,2011-12-11 00:00:00,-18.1394,125.7750,0,,"A broad trough lying east-west over the northern Kimberley generated widespread thunderstorm activity. The co-op observer at Fossil Downs, east of Fitzroy Crossing, reported a 'small, intense tornado' as part of the daily observations at the station. Tornado in Kimberley",,,,,,,,
1271,2014-11-22 06:00:00,-34.1721,142.2486,0,,"Sunraysia Daily reports tornado and associated extensive crop damage in a band extending from Yelta (Victoria) through to Gol Gol North (SW NSW). Trees uprooted/snapped, vineyards damaged, roofs off houses/sheds. Large hail also reported. Seems likely supercell-related based on observations of a BWER recorded in logbook. Estimates that damage and crop losses are likely to run into tens of millions of dollars. Details of path length, direction and width are estimated form the media article. Media reports of tornado and hail damage reported at Gol Gol North (NE of Mildura, in SW NSW) with thunderstorms.",,,,,,,,
1272,2014-11-05 06:35:00,-30.9484,150.2511,0,,"ABC Emergency Twitter/Gunnedah SES: anecdotal reports of a small tornado. Thunderstorms in area at the time. A thunderstorm cell produced a 57 knot gust at Gunnedah, and a 59 knot gust at Tamworth. Synoptic: low pressure trough moving across the state produced multiple severe thunderstorm cells (events) across central and NE NSW.",,,,,,,,
1273,2014-12-04 09:05:00,-34.6556,150.2996,0,,Video footage supports 'gustnado'. Questionable tornado at Bundanoon. 'Gustnado' more likely (according to Harald Richter).,,,,,,,,
1274,2014-07-14 00:00:00,0.0000,0.0000,0,,The cold front which passed over the southwest generating this event also produced isolated severe weather over other locations. Tornadoes in Perth,,,,,,,,
1275,2014-09-07 00:00:00,-31.9800,115.9936,0,,"The passage of two strong cold fronts produced widespread, mainly minor damage, over southern WA. The first front moved through southern WA from late Sunday into Monday and produced the most damage. Given the damage path, it is likely that a tornado moved through Forrestfield (suburb, southeast of Perth). The second front moved through southwest WA from Monday afternoon to early Tuesday. There were very few reports of damage with the passage of the second front. Two strong cold fronts",,,,,,,,
1276,2014-11-22 00:00:00,-34.1828,142.2154,0,,"Destructive storms, localised hail and intense rain reported, though not with any specific detail. AWS no report of severity. NULL",,,,,,,,
1277,2015-02-23 04:00:00,-36.3846,145.4045,0,,several eye witnesses. damage reported in area. evidence of strong meso-scale on radar. NULL,,,,,,,,
1278,2015-02-28 08:00:00,-37.3415,144.1440,0,,Hepburn Courier reports of mini tornado 150m wide by couple of km. NULL,,,,,,,,
1279,2012-11-09 23:00:00,-42.8900,147.3000,0,,There was no known damage from this funnel cloud. It may not have been associated with a thunderstorm. No lightning was detected in the area at the time. NULL,,,,,,,,
1280,2012-11-09 23:05:00,-42.8100,147.4600,0,,"The tornado was observed for 5 to 10 minutes. Rotation was evident, there was whirling dust/debris near ground level and a howling noise was heard. The path the tornado took was from the southeast to the northwest. The tornado was about 50m in width and travelled about 1.5km. No damage was observed. NULL",,,,,,,,
1281,2015-02-13 06:35:00,-37.4264,143.8863,0,,Photos show rotating cloud reaching ground. NULL,,,,,,,,
1282,2015-08-24 06:00:00,-32.2484,148.6012,0,,Jonny from SES called with report of a tornado at Dubbo around 5-5:15 PM. Police got some more calls with reports of partial roofs off houses and very strong winds. Jonny relayed this info through. Possible footage too. No GPATS over Dubbo at this time but there were a couple near Gilgandra. Tornado,,,,,,,,
1283,2015-10-22 00:00:00,-31.5651,149.9845,0,,Reports (via Graham Creed's Twitter) of tornado at Bundlla. SES had first heard reports around middle of the day. Timing sometime around late morning. NULL,,,,,,,,
1285,2015-10-27 00:00:00,-29.6817,148.8012,0,,Image of tornado by local (Barry Newman) is on record. The event has been legitamised and has had a case study written about it for further investigations. NULL,,,,,,,,
1286,2015-10-31 06:20:00,-36.1401,144.5581,0,,Jane O'Neill reported (and supplied photo) of a funnel cloud associated with storm just west of Echuca. Multiple reports of severe phenomena associated with left-moving storm in northern Victoria.,,,,,,,,
1287,2015-11-01 03:30:00,-36.0527,145.2059,0,,Social media (YouTube) shows multiple vortices at Nathalia. Corresponds to the inflexion point of the squall line on RADAR. https://youtu.be/Cpppj8hgov4 Storms developed into a squall line over northern Victoria/Southern NSW which moved into the NE during the afternoon with multiple reports of wind damage. Doppler RADAR showed winds up to 130km/h at 3500ft along back edge of squall line.,,,,,,,,
1288,2015-11-05 02:30:00,-37.6023,144.9428,0,,"Multiple reports between 1:30 and 2:00pm EDT of funnel cloud. A storm spotter reported seeing two separate funnels touch down. Reports from Campbellfield, Craigieburn and Melbourne Airport. NULL",,,,,,,,
1289,2015-08-29 05:00:00,-33.3403,115.6419,0,,"NULL The passage of a cold front during the day produced several waterspouts around the Perth area and a likely tornado in Bunbury. A narrow swathe of damage around 700 m long was reported from the Bunbury suburb of Usher around 1 pm WST. DFES reported about 10 call outs for damage to trees, fences, patio, tiles and ridge capping. The Serpentine radar image at 0450 UTC showed an enhanced cell approaching the coast to the south of the city with an unusual velocity signal at an elevation of approximately 10 000 feet. The environment was more unstable than the usual winter time front. The cell formed over the ocean to the west of Bunbury where CAPE values in ACCESS R fields were between 200 and 500 J/Kg. The storm cell formed in the warm air mass ahead of the front on a northerly to northwest convergence line. ACCESS R fields indicated some areas of overlap of shear, instability and up motion.",,,,,,,,
1290,2015-09-10 03:00:00,-34.2967,117.5542,0,,NULL The passage of a cold front produced showery and windy conditions over southwest WA. Damage consistent with the passage of a tornado was reported at Cranbrook on the leading edge of the front. Cape Leeuwin recorded a gust of 49 knots (at 4:00am) in the pre-frontal air stream and 51 knots (94 km/h) at 2:33pm in the post-frontal air stream.,,,,,,,,
1291,2015-12-03 19:30:00,-30.7492,121.4656,0,0,"A severe thunderstorm near Kalgoorlie caused some injuries and significant damage at KCGM (Super Pit). Below is an extract from their damage report: The extent of the damage caused by a severe thunderstorm at KCGM on Friday is still being assessed. Around 3.30pm on 4th December, tornado-like conditions swept through parts of the operation, causing significant damage. The mobile fleet maintenance workshops were the worst hit; with major structural damage, power, communication and water services being cut. The Open Pit administration office was also damaged, with the entrance doors being blown in and internal ceiling panels collapsing. A number of large trees were also uprooted and power lines brought down. KCGM General Manager Ian Butler said the storm was so intense it was lucky there weren't more serious injuries. One person received a fracture in his foot", and three others were treated for minor first aid injuries,"he said.%D %D Kalgoorlie Doppler Radar image at 0725 UTC (1525 WST) showed a pixel which had an inbound velocity of around 110 km/h at a height of ~487 metres above the ground (aliased: 22.5 m/s outbound). A severe thunderstorm near Kalgoorlie caused some injuries and significant damage at KCGM (Super Pit). Below is an extract from their damage report: The extent of the damage caused by a severe thunderstorm at KCGM on Friday is still being assessed. Around 3.30pm on 4th December, tornado-like conditions swept through parts of the operation, causing significant damage. The mobile fleet maintenance workshops were the worst hit; with major structural damage, power, communication and water services being cut. The Open Pit administration office was also damaged, with the entrance doors being blown in and internal ceiling panels collapsing. A number of large trees were also uprooted and power lines brought down. KCGM General Manager Ian Butler said the storm was so intense it was lucky there weren't more serious injuries. One person received a fracture in his foot", and three others were treated for minor first aid injuries,he said.%D %D Kalgoorlie Doppler Radar image at 0725 UTC (1525 WST) showed a pixel which had an inbound velocity of around 110 km/h at a height of ~487 metres above the ground (aliased: 22.5 m/s outbound).,,,,
1292,2015-05-01 00:00:00,-20.7306,116.8447,0,,"NULL A tornado was filmed near Karratha, associated with the rainbands of TC Quang. A video was supplied to the BOM.",,,,,,,,
1293,2015-12-04 07:30:00,-30.7492,121.4656,0,0,"NULL A severe thunderstorm near Kalgoorlie caused some injuries and significant damage at KCGM (Super Pit). Below is an extract from their damage report: The extent of the damage caused by a severe thunderstorm at KCGM on Friday is still being assessed. Around 3.30pm on 4th December, tornado-like conditions swept through parts of the operation, causing significant damage. The mobile fleet maintenance workshops were the worst hit; with major structural damage, power, communication and water services being cut. The Open Pit administration office was also damaged, with the entrance doors being blown in and internal ceiling panels collapsing. A number of large trees were also uprooted and power lines brought down. KCGM General Manager Ian Butler said the storm was so intense it was lucky there weren't more serious injuries. One person received a fracture in his foot", and three others were treated for minor first aid injuries,he said.%D %D Kalgoorlie Doppler Radar image at 0725 UTC (1525 WST) showed a pixel which had an inbound velocity of around 110 km/h at a height of ~487 metres above the ground (aliased: 22.5 m/s outbound).,,,,,,
1294,2013-04-23 06:00:00,-23.5415,147.9697,0,,Possible tornado from a second hand report in the area in between Emerald and Anakie at around 4:00pm AEST. NULL,,,,,,,,
1295,2013-04-23 07:00:00,-24.1800,149.8100,0,,"Possible tornado at Baralaba (west of Gladstone) around 5:00pm AEST. Residents say a twister about 100 metres wide whipped through the main street, damaging buildings and breaking large tree limbs. NULL",,,,,,,,
1296,2013-11-15 21:15:00,-27.3400,153.3600,0,,Tornado observed in Moreton Bay (offshore of Brisbane Airport) around 7:15am AEST. No damage reported. NULL,,,,,,,,
1297,2015-07-11 05:15:00,-35.8318,146.8013,0,,"Tornado caused trees to be knocked down. Police called, people sighted it. Squall line thunderstorms passing through at the time. No other property damage other than trees. NULL",,,,,,,,
1298,2015-12-15 23:30:00,-34.0151,151.2012,2,,"A clear and narrow damage path was noted during this event which is supported by the radar signatures at the time. The strongest evidence to support tornadic activity is a gust of 213km/h at Kurnell AWS at 10.33am, with SES reports confirming the removal of rooves from houses and uprooting of mature trees in the area. A range of images from online social and news media also show damage to a number of properties in Kurnell, an over turned truck, and the partial removal of the roof of the desalination plant. The strength of the observed wind gust and onsite visual evidence of the damage place this tornado in the F2 category. Later reports emerged (~11.40am) from head office media stating a number of callers from Bondi Beach sighting a tornado. Based on radar data at this time and no specific damage reports it was most likely offshore. LGA: Sutherland Shire. NULL",,,,,,,,
1299,2016-01-22 05:00:00,-32.4817,150.9011,0,,"A highly organised supercell thunderstorm was evident on radar west of Jerrys Plains around 3pm. This cell tracked slowly east towards Singleton by 4.30pm, then northeast towards Nabiac by 6.30pm. Doppler radar showed a clearly defined low level velocity couplet lasting for over an hour with this storm, weakening once the cell tracked past Singleton. The SES reported significant damage at Doyles Creek and Singleton, including some roofs partially or fully lifted off, trees down on roads, and some trees crushing cars. Secondhand reports (friend of a storm spotter) were received of tornado damage at the Darley and Coolmore Horse Studs and mines including trees ripped out of the ground. The location of this report is consistent with the position of the low level velocity couplet. One photo on social media shows a mature tree with large branches broken off and a wire fence bent over at Jerrys Plains, with all debris aligned in the same direction. Tornadic activity seems likely but difficult to estimate path lengths or EF scales without more detailed investigation. NULL",,,,,,,,
1300,2016-01-30 12:30:00,-35.4294,149.5011,2,,"A strong line of fast moving thunderstorms, possibly supercells, moved through the Forbes Creek/Hoskinstown area late on Saturday night (approximately 11.30pm), spawning at least one tornado. A damage survey conducted onsite showed numerous Eucalypts had been snapped and Pines uprooted, a kit home damaged, shearing shed demolished, and front wall of a double brick structure destroyed. The estimated width of the damage swathe was 150m, with the SES reporting damage along a 3km path. Other reports from the SES include major structural damage to 6 properties in the Forbes Creek/Hoskinstown area, with a number of trees down on access roads. Numerous media articles (SMH, ABC, Canberra Times) were written for this event, and photos posted on the Queanbeyan Facebook page showing significant damage to structures and properties. Estimated strength: EF2. NULL",,,,,,,,
1301,2016-01-30 07:20:00,-29.4187,153.2849,1,,"A fast moving thunderstorm (possibly a right moving supercell) moved through Palmers Island (west of Yamba) shortly after 6pm, bringing signficant and very localised damage to the area. Media articles and SES reports describe the narrow path of damage 2 or 3 streets wide"" which includes: some building collapses", trees and wires down, lots of strewn debris, some rooves ripped off and walls pushed over. The main damage occured along Gordon Street. The narrow damage path and the scale of the damage seem consistent with a tornado,"possibly at the high end of the EF1 scale. Path length difficult to estimate without any further onsite evidence. NULL""",,,,
1302,2016-08-22 01:55:00,-37.7043,144.5713,0,,Report of funnel cloud observed approximately 15km NW of Caroline Springs. Multiple reports of funnel cloud with several photos/video on social media.,,,,,,,,
1303,2016-08-22 02:05:00,-37.7841,144.7150,0,,Report of funnel cloud observed at Truganina. Multiple reports of funnel cloud with several photos/video on social media.,,,,,,,,
1304,2016-08-22 03:10:00,-36.5460,145.9833,0,,Report of funnel cloud observed at Benalla. NULL,,,,,,,,
1305,2016-10-21 04:35:00,-33.9126,151.1180,0,,Two separate spotter reports forwarded by SES HQ. Construction debris was lifted onto Moxon rd Canterbury. The sea breeze was going through at the time so it could have been stretching of vertical vorticity associated with the sea breeze boundary. Otherwise no showers or storms present or strong winds reported at nearby AWS.%D NULL,,,,,,,,
1306,2016-10-21 09:00:00,-33.1373,148.1747,0,,"Spotter report: trees were flattened through a narrow pass, with major damage such as trees and power lines down and scattered in different locations. He had numerous reports. There were 2 cells that went through Parkes, at 8UTC (7pm) and 9UTC (8pm), not sure which one it's from.%D NULL",,,,,,,,
1307,2014-12-17 09:00:00,-25.0000,152.0800,0,,Tornado observed near Bungadoo (east of Gin Gin) around 7pm AEST. Social media reported that numerous tree branches had been snapped and that some trees had been brought down in the area (no images available to ascertain size of the trees or the depth of their roots). NULL,,,,,,,,
1308,2014-12-06 05:00:00,-18.4400,145.9300,2,,"Tornado observed in Abergowrie around 3pm AEST. Witness alledges seeing two tornadoes, approximately 60m apart. Media images show the roof removed off a house and articles write of trees being uprooted. NULL",,,,,,,,
1311,2013-01-26 02:50:00,-24.8100,152.4600,2,,"It was concluded that damage in parts of Bargara matched the specifications of an F2 tornado. The evidence used to come to this conclusion included images of roofs being torn off frame houses and large trees being uprooted. Rapid Damage Assessment data supplied by Queensland Fire and Emergency Services noted that two properties had lost roofs during the event. An image of an upside down caravan may have also marginally met the specification of an F2 tornado. The first confirmed tornado during the Oswald tornado event. Video footage of the tornado was captured. Doppler radar indicated the presence of a ""moderate to strong"" mesocyclone near the Bargara coast prior to impact. Rapid Damage Assessment data supplied by Queensland Fire and Emergency Services showed a clear path of damage through Bargara. NULL",,,,,,,,
1312,2016-06-19 07:45:00,-26.6900,153.1100,2,,Possible tornado in Mooloolaba around 5:45pm AEST. Media images indicated that roofs had been removed off two apartment blocks in Akeringa Place. NULL,,,,,,,,
1313,2016-11-11 05:17:00,-31.9652,141.4513,2,,"Tornado observation by multiple storm spotters (ID 35 and 1905), who observered a broad column extending from cloud base to ground, a well defined rotation, and raised debris. Estimate from one spotter of F2 intensity. Reported damage included large branches down, trees snapped and uprooted, and roofing tiles and iron lifted. Time of event based on earliest report time. Reports also included large hail, damaging winds, and heavy rainfall. NULL",,,,,,,,
1314,2017-04-08 16:30:00,-38.0800,145.4801,0,,"Rotation evident in clouds, no tornado. NULL",,,,,,,,
1316,2017-10-26 05:34:00,-32.2123,152.3193,0,,Funnel cloud observed. NULL,,,,,,,,
1317,2017-11-05 07:30:00,-29.1500,153.2833,0,,"Storm spotter in New Italy reports a very severe"" thunderstorm passed over the region at around 6:30pm. Going by damage (trees knocked over", with pattern of falling suggesting some rotation)," possible tornado event. NULL""",,,,,,
1318,2017-11-16 07:30:00,-34.6810,146.2710,0,,"Tornado report with funnel cloud reaching the ground, photos provided for confirmation. NULL",,,,,,,,
1319,2017-11-16 08:15:00,-31.8151,149.1179,0,,"Photo and video of tornado on ground provided by storm spotter. No damage observed, but touchdown was in the Goonoo State Forest. Intensity on F-Scale unknown. NULL",,,,,,,,
1320,2019-03-05 05:20:00,-36.0100,146.0200,0,,Report provided by Victorian Regional Office. Radar shows small transient cell moving across to the north of Yarrawonga. No additional information on size and duration from report. NULL,,,,,,,,
1322,2018-12-19 08:30:00,-31.5500,150.6800,0,,"Higgins Storm chaser reported tornado 20km S of Tamworth. Image was provided showing rainwrapped funnel, and is consistent with a left moving supercell seen on the radar to the south of Tamworth at a similar time. NULL",,,,,,,,
1323,2019-12-15 09:00:00,-34.0651,151.0846,0,,"Power poles snapped, large trees pulled out of the ground, and damage from trees falling onto houses/structures. No images of a funnel, though winds from supercell and analysis of radar images, do show some low level rotation and can't be rules out. There was no clear tornado path from aerial video to suggest a touchdown. NULL",,,,,,,,
1324,2019-12-21 08:30:00,-31.1095,150.9147,0,,"Images of funnel cloud supplied by media of funnel cloud. No SES report of damage, though radar assessment does show a strong low level rotation at the time of the observations that may be suitable to tornadogenesis. Exact location 20km S of Tamworth. NULL",,,,,,,,
1325,2018-12-21 08:30:00,-31.1095,150.9147,0,,"Images of funnel cloud supplied by media of funnel cloud. No SES report of damage, though radar assessment does show a strong low level rotation at the time of the observations that may be suitable to tornadogenesis. Exact location 20km S of Tamworth. NULL",,,,,,,,
1326,2017-10-02 08:00:00,-25.4000,152.9000,1,,Queensland Fire and Emergency Services advised of a triple zero call notifying them of a tornado at River Heads at 6pm AEST. Media images showed a partial loss of roofing and a collapsed shed (weak looking structure). Rapid Damage Assessments conducted by QFES after the event showed a path of damage through River Heads. NULL,,,,,,,,
1327,2017-10-02 04:00:00,-24.9000,152.3500,2,,"Queensland Fire and Emergency Services advised that some houses had lost roofs and powerlines were down in Avenell Heights at 2:35pm. Storm Spotter (bomg0007) submitted a report of a ""funnel"" cloud and ""large trees snapped"" at Avenell Heights at 2pm AEST. Media images showed that some houses had lost some or all of their roofing and at one property a garage appears to have lost its roof and side wall (weak looking structure). Rapid Damage Assessments conducted by QFES after the event showed a path of damage through Avenell Heights. NULL",,,,,,,,
1331,2011-01-30 13:00:00,-21.3800,149.3100,1,,"Possible tornado in Campwin Beach overnight between the 30th and the 31st, approximate time of the event is unknown (11pm AEST estimated from radar). Media articles wrote of trees down and the front of a house being down, though no images were available. NULL",,,,,,,,
1332,2012-03-18 17:30:00,-18.6300,146.2600,0,,"Possible tornado at Braemeadows during the early hours"". Media article wrote of 10 hectares of sugar cane being destroyed"," trees being snapped and a shed door being blown in. NULL""",,,,,,,
1333,2012-03-19 17:00:00,-19.2400,146.7700,2,,"It was concluded that damage in parts of Townsville matched the specifications of an F2 tornado. The evidence used to come to this conclusion included images of roofs being torn off frame houses, large trees being uprooted and some light objects appearing to have become missiles. The tornado of the event happened in parts of Townsville between the airport and the suburbs of Vincent and Gulliver. Radar evidence indicated the presence of a Bounded Weak Echo Region, which is a characteristic signature of a supercell thunderstorm. The damage assessment conducted by James Cook University indicated a path of damage that correlates with the passage of the supercell signature on radar. The report also noted that tree damage appeared to be convergent across the area, which corresponds more closely to the damage pattern associated with the passage of a tornado. Significant wind gust observations were also recorded around Townsville Airport during the event, including a 3 second wind gust of 111km/h at 5:07am AEST at the Automatic Weather Station and a wind gust of 135km/h at the Dines anemometer. NULL",,,,,,,,
